LABORATOIRES BOUCHARA - RECORDATI,Pharmacien,KILIC MATHILDE,16/10/2013,Repas,€40,,
LABORATOIRES BOUCHARA - RECORDATI,Préparateur en pharmacie et préparateur en pharmacie hospitalière,BALLAN DOMINIQUE,16/10/2013,Repas,€40,,
LABORATOIRES OMEGA PHARMA FRANCE,Pharmacien,GRAND CLEMENCE,18/09/2013,INVITATIONS,€20,,
LABORATOIRES OMEGA PHARMA FRANCE,Pharmacien,KILIC MATHILDE,18/09/2013,INVITATIONS,€20,,
PAUL HARTMANN SA,Préparateur en pharmacie et préparateur en pharmacie hospitalière,BUARD ADELINE,08/10/2013,Repas,€30,,
SANOFI AVENTIS FRANCE,Pharmacien,KILIC MATHILDE,13/09/2013,Restauration,€40,,
SEPTODONT SAS,Association professionnel de santé,LABBE & MENARD,22/11/2012,Cadeaux,€144,,
