MSD France,Pharmacien,CASADEI DELLA CHIESA PHILIPPE,20/06/2013,20/06/2013 -,CONVENTION D’HOSPITALITÉ,,
MSD France,Pharmacien,CASADEI DELLA CHIESA PHILIPPE,20/06/2013,20/06/2013 -,CONVENTION D’HOSPITALITÉ,,
MSD France,Préparateur en pharmacie et préparateur en pharmacie hospitalière,CASADEI DELLA CHIESA MARTINE,20/06/2013,20/06/2013 -,CONVENTION D’HOSPITALITÉ,,
MSD France,Préparateur en pharmacie et préparateur en pharmacie hospitalière,CASADEI DELLA CHIESA MARTINE,20/06/2013,20/06/2013 -,CONVENTION D’HOSPITALITÉ,,
MUNDIPHARMA,Médecin,BODAK PHILIPPE,08/06/2013,08/06/2013 - 08/06/2013,AUTRE : CONVENTION D'HOSPITALITE,,
TEVA SANTE SAS,Autres types de personne morale,PHIE CASADEI DELLA CHIESA,01/07/2013,01/07/2013 - 30/09/2013,AUTRE : ACHAT D'ESPACE,,
TEVA SANTE SAS,Autres types de personne morale,PHIE CASADEI DELLA CHIESA,05/12/2013,01/01/2014 - 31/03/2014,AUTRE : ACHAT D'ESPACE,,
WorldOne Group B.V.,Médecin,CECCONI JOËL,12/11/2013,12/11/2013 -,AUTRE: [ETUDE DE MARCHE],,
